{
  "$schema": "https://json-schema.org/draft/2020-12/schema",
  "$id": "https://omadia.ai/protocol/1.1/scene.schema.json",
  "title": "Scene primitive (editor-class, 1.1)",
  "description": "omadia-canvas-protocol/1.1 (lumens-spec.md §3): a declarative immediate-mode draw surface — the 25th primitive. A Lumen `view` emits, per render, a draw-list from a CLOSED shape vocabulary; there is no canvas 2d/webgl script. Colours are theme tokens + the active Lume palette ONLY (a scene is always on-theme). Coordinates are buffer-native (independent of zoom/pan). A SceneNode `id` is a stable element id ⇒ a TargetRef for beams/events/wires.",

  "$ref": "#/$defs/scene",

  "$defs": {
    "scene": {
      "type": "object",
      "additionalProperties": false,
      "required": ["type", "width", "height", "draw"],
      "properties": {
        "type": { "const": "scene" },
        "id": { "type": "string", "description": "stable element id" },
        "width": { "type": "integer", "minimum": 1, "description": "buffer-native coordinate space" },
        "height": { "type": "integer", "minimum": 1 },
        "camera": {
          "type": "object", "additionalProperties": false,
          "properties": { "x": { "type": "number" }, "y": { "type": "number" }, "zoom": { "type": "number", "exclusiveMinimum": 0 } }
        },
        "draw": { "type": "array", "items": { "$ref": "#/$defs/sceneNode" } }
      }
    },

    "colorToken": {
      "description": "Lume theme tokens + active palette only. Free-form colours are clipped by the Tier-1 normaliser (§3).",
      "enum": [
        "accent", "accent.glow", "accent.glow-soft", "accent.glow-core",
        "surface", "surface-raised", "surface-sunken",
        "text", "text-muted", "text-faint",
        "neutral", "info", "success", "warning", "danger", "transparent"
      ]
    },

    "typeRegister": {
      "description": "the three Lume type registers (visual-spec.md §2.7)",
      "enum": ["display", "prose", "mono"]
    },

    "transform": {
      "type": "object", "additionalProperties": false,
      "properties": {
        "x": { "type": "number" }, "y": { "type": "number" },
        "scale": { "type": "number" }, "rotate": { "type": "number", "description": "degrees" }
      }
    },

    "sceneNode": {
      "type": "object",
      "oneOf": [
        { "$ref": "#/$defs/n_rect" },
        { "$ref": "#/$defs/n_circle" },
        { "$ref": "#/$defs/n_line" },
        { "$ref": "#/$defs/n_path" },
        { "$ref": "#/$defs/n_sprite" },
        { "$ref": "#/$defs/n_text" },
        { "$ref": "#/$defs/n_group" }
      ]
    },

    "n_rect": {
      "type": "object", "additionalProperties": false, "required": ["kind", "x", "y", "w", "h"],
      "properties": {
        "kind": { "const": "rect" },
        "x": { "type": "number" }, "y": { "type": "number" }, "w": { "type": "number" }, "h": { "type": "number" },
        "r": { "type": "number", "minimum": 0, "description": "corner radius" },
        "fill": { "$ref": "#/$defs/colorToken" }, "stroke": { "$ref": "#/$defs/colorToken" }, "strokeW": { "type": "number", "minimum": 0 },
        "id": { "type": "string" }, "hitPadding": { "$ref": "#/$defs/hitPadding" }
      }
    },
    "n_circle": {
      "type": "object", "additionalProperties": false, "required": ["kind", "cx", "cy", "r"],
      "properties": {
        "kind": { "const": "circle" },
        "cx": { "type": "number" }, "cy": { "type": "number" }, "r": { "type": "number", "minimum": 0 },
        "fill": { "$ref": "#/$defs/colorToken" }, "stroke": { "$ref": "#/$defs/colorToken" }, "strokeW": { "type": "number", "minimum": 0 },
        "id": { "type": "string" }, "hitPadding": { "$ref": "#/$defs/hitPadding" }
      }
    },
    "n_line": {
      "type": "object", "additionalProperties": false, "required": ["kind", "x1", "y1", "x2", "y2", "stroke"],
      "properties": {
        "kind": { "const": "line" },
        "x1": { "type": "number" }, "y1": { "type": "number" }, "x2": { "type": "number" }, "y2": { "type": "number" },
        "stroke": { "$ref": "#/$defs/colorToken" }, "strokeW": { "type": "number", "minimum": 0 },
        "id": { "type": "string" }, "hitPadding": { "$ref": "#/$defs/hitPadding" }
      }
    },
    "n_path": {
      "type": "object", "additionalProperties": false, "required": ["kind", "points"],
      "properties": {
        "kind": { "const": "path" },
        "points": { "type": "array", "items": { "type": "array", "items": { "type": "number" }, "minItems": 2, "maxItems": 2 } },
        "closed": { "type": "boolean" },
        "fill": { "$ref": "#/$defs/colorToken" }, "stroke": { "$ref": "#/$defs/colorToken" }, "strokeW": { "type": "number", "minimum": 0 },
        "id": { "type": "string" }, "hitPadding": { "$ref": "#/$defs/hitPadding" }
      }
    },
    "n_sprite": {
      "type": "object", "additionalProperties": false, "required": ["kind", "x", "y", "w", "h", "dataRef"],
      "properties": {
        "kind": { "const": "sprite" },
        "x": { "type": "number" }, "y": { "type": "number" }, "w": { "type": "number" }, "h": { "type": "number" },
        "dataRef": { "$ref": "https://omadia.ai/protocol/1.0/data-ref.schema.json" },
        "id": { "type": "string" }, "hitPadding": { "$ref": "#/$defs/hitPadding" }
      }
    },
    "n_text": {
      "type": "object", "additionalProperties": false, "required": ["kind", "x", "y", "text"],
      "properties": {
        "kind": { "const": "text" },
        "x": { "type": "number" }, "y": { "type": "number" },
        "text": { "type": "string" },
        "size": { "type": "number", "exclusiveMinimum": 0 },
        "weight": { "type": "integer", "minimum": 100, "maximum": 900 },
        "register": { "$ref": "#/$defs/typeRegister" },
        "fill": { "$ref": "#/$defs/colorToken" },
        "id": { "type": "string" }, "hitPadding": { "$ref": "#/$defs/hitPadding" }
      }
    },
    "n_group": {
      "type": "object", "additionalProperties": false, "required": ["kind", "children"],
      "properties": {
        "kind": { "const": "group" },
        "transform": { "$ref": "#/$defs/transform" },
        "children": { "type": "array", "items": { "$ref": "#/$defs/sceneNode" } },
        "id": { "type": "string" }, "hitPadding": { "$ref": "#/$defs/hitPadding" }
      }
    },

    "hitPadding": {
      "type": "number", "minimum": 0,
      "description": "buffer-px expansion of the hit area; the runtime additionally enforces a 44pt minimum hit-target (§4) regardless of drawn glyph size"
    }
  }
}
